{
  "schema_version": "vb.run_record/1",
  "record_id": "b3:…",
  "experiment_id": "LOG1",
  "run_id": "vb-20261012-a41",
  "arm": "cheap_direct",
  "seed": 2,
  "replicate": 0,
  "harness_sha": "725f21e05",
  "dirty": true,
  "config_hash": "b3:…",
  "price_snapshot_id": "prices-2026-09-28",
  "suite": {
    "id": "vb",
    "hash": "sha256:…",
    "generator_versions": {
      "F4": "f4-1.0.0"
    }
  },
  "stream": {
    "id": "p1_core",
    "position": 37,
    "length": 120,
    "perturbations_active": []
  },
  "task": {
    "family": "F4",
    "instance_id": "F4-l3-0017",
    "ladder": 3,
    "latent_version": "v1",
    "spec_variant": "precise",
    "is_honeypot": false
  },
  "execution": {
    "status": "completed",
    "attempts": [
      {
        "emitter": "vb-driver",
        "model_requested": "gpt-oss-120b",
        "model_reported": "gpt-oss-120b",
        "provider": "cerebras",
        "turns": 9,
        "usage": {
          "tokens_in": 61234,
          "tokens_out": 2210,
          "tokens_cache_read": 0,
          "tokens_reasoning": 640
        },
        "fault_injected": null
      }
    ]
  },
  "visible": {
    "passed": true,
    "clean_rerun": true,
    "flake_injected": false
  },
  "vs": {
    "label": 0,
    "unknown": false,
    "checks": {
      "completion": 1,
      "visible_clean": 1,
      "hidden": 0,
      "integrity": 1
    },
    "truth_suite_version": "1.0.0",
    "failed": [
      "store_state.partial_failure"
    ]
  },
  "costs": {
    "api_equiv_usd": 0.0231,
    "billed_usd": 0.0231,
    "without_cache_usd": 0.0231,
    "vendor_usd": null,
    "source": "provider_usage",
    "meter_cross_check_usd": 0.0231
  },
  "provenance": {
    "final_commit": "9c1e…",
    "workdir_archive": "archives/F4-l3-0017.s2.tar.zst",
    "diff_sha256": "…",
    "transcript_ref": null,
    "s01_run_dir": null,
    "canary_hits": 0
  },
  "simulated": false
}
